{
  "$schema": "https://json-schema.org/draft/2020-12/schema",
  "$id": "https://microspec.dev/shell-actions.schema.json",
  "title": "microspec shell action catalogue",
  "type": "object",
  "additionalProperties": false,
  "required": ["bridgeVersion", "actions"],
  "properties": {
    "$comment": { "type": "string" },
    "bridgeVersion": {
      "type": "integer",
      "minimum": 1,
      "description": "The bridge version the CURRENT template implements. A shell reports its own; the facade compares the two, because the web ships in minutes and an APK ships when the user reinstalls it."
    },
    "flavours": {
      "type": "object",
      "description": "Which shell template flavours CARRY a capability, by capability name. A capability absent here is in every trusted flavour (full and the heavier ones); one listed here is granted only by the flavours named — the engine's `godot` lives only in the template that links the engine. The template generator derives each flavour's grant list from this, so no list is typed by hand.",
      "propertyNames": { "pattern": "^[a-z-]+$" },
      "additionalProperties": {
        "type": "array",
        "minItems": 1,
        "uniqueItems": true,
        "items": { "type": "string", "enum": ["full", "godot", "mesh", "flash"] }
      }
    },
    "actions": {
      "type": "array",
      "minItems": 1,
      "items": {
        "type": "object",
        "additionalProperties": false,
        "required": ["id", "capability", "kind", "minBridge", "android", "summary", "args", "result", "mock"],
        "properties": {
          "id": {
            "type": "string",
            "pattern": "^[a-z]+\\.[a-zA-Z]+$",
            "description": "capability.method — the wire name and the facade key."
          },
          "capability": {
            "type": "string",
            "enum": ["notify", "alarm", "background", "media", "wifi", "cell", "ble", "advertise", "advertise-raw", "usb", "location", "files", "system", "server", "lan", "share", "godot", "mesh", "flash"],
            "description": "Permission group and bridge flag. The registry in docs/research/apk-sdk-plan.md §3."
          },
          "kind": {
            "type": "string",
            "enum": ["call", "subscribe"],
            "description": "call = request/response. subscribe = a native-pushed stream until cancelled; without it every streaming capability degenerates into polling across the bridge."
          },
          "minBridge": { "type": "integer", "minimum": 1, "description": "Oldest shell that implements this action." },
          "android": {
            "type": "array",
            "items": { "type": "string", "pattern": "^[A-Z_]+$" },
            "description": "Android permissions the action needs, unprefixed (CAMERA, ACCESS_FINE_LOCATION)."
          },
          "summary": { "type": "string", "minLength": 1 },
          "args": { "type": "object", "description": "JSON Schema for the argument object." },
          "result": { "type": "object", "description": "JSON Schema for the resolved value." },
          "mock": {
            "description": "Deterministic value the facade returns under the gate, so the has-bridge branch of every app is exercised in Chromium — which never runs the APK."
          }
        }
      }
    }
  }
}
