{
  "$comment": "THE CATALOGUE. Single source of truth for everything the Android shell can do for a page. Everything else is generated from it: the runtime facade's action table, the gate mocks, the permission enum, the Java dispatch registry (phase 3), and the docs. Hand-writing any of those is how the two sides drift. See docs/research/apk-sdk-plan.md.",
  "bridgeVersion": 37,
  "flavours": {
    "godot": ["godot"],
    "mesh": ["mesh"]
  },
  "actions": [
    {
      "id": "system.info",
      "capability": "system",
      "kind": "call",
      "minBridge": 1,
      "android": [],
      "summary": "What the shell is and what it runs on — the one action that needs no permission, so it is also how a page proves the bridge works end to end.",
      "args": {
        "type": "object",
        "additionalProperties": false,
        "properties": {}
      },
      "result": {
        "type": "object",
        "required": [
          "bridge",
          "sdk",
          "model"
        ],
        "additionalProperties": false,
        "properties": {
          "bridge": {
            "type": "integer",
            "description": "Bridge version this shell implements."
          },
          "sdk": {
            "type": "integer",
            "description": "Build.VERSION.SDK_INT."
          },
          "release": {
            "type": "string",
            "description": "Build.VERSION.RELEASE, e.g. '16'."
          },
          "model": {
            "type": "string",
            "description": "Build.MODEL."
          },
          "pkg": {
            "type": "string",
            "description": "This APK's patched package name."
          },
          "caps": {
            "type": "string",
            "description": "Capabilities THIS APK grants the page, read from its baked-in bridge.json. Without it a refusal is indistinguishable from a missing implementation."
          },
          "version": {
            "type": "string",
            "description": "versionName of the installed APK."
          },
          "build": {
            "type": "integer",
            "description": "versionCode."
          },
          "installed": {
            "type": "integer",
            "description": "When this copy was installed or last updated — the only way to tell which build you are holding."
          },
          "perms": {
            "type": "object",
            "description": "Android permission -> held. What a tile needs to say full / partial / none honestly."
          },
          "locationOn": {
            "type": "boolean",
            "description": "Location services, device-wide. Off returns an EMPTY ble/wifi scan with no error — the most confusing failure in the whole bridge, because every permission still reads as granted."
          }
        }
      },
      "mock": {
        "bridge": 1,
        "sdk": 36,
        "release": "16",
        "model": "Gate Device",
        "pkg": "apk.microspec.a0000000000000000",
        "caps": "alarm,background,location,notify,system",
        "version": "1.0",
        "build": 1,
        "installed": 1893479400000,
        "perms": {
          "POST_NOTIFICATIONS": true,
          "RECEIVE_BOOT_COMPLETED": true,
          "FOREGROUND_SERVICE": true,
          "ACCESS_FINE_LOCATION": true,
          "ACCESS_BACKGROUND_LOCATION": false,
          "ACCESS_WIFI_STATE": true,
          "READ_PHONE_STATE": true,
          "BLUETOOTH": true,
          "BLUETOOTH_ADMIN": true,
          "BLUETOOTH_SCAN": false,
          "REQUEST_INSTALL_PACKAGES": true
        },
        "locationOn": true
      }
    },
    {
      "id": "notify.show",
      "capability": "notify",
      "kind": "call",
      "minBridge": 1,
      "android": [
        "POST_NOTIFICATIONS"
      ],
      "summary": "Post a system notification. WebView has no Notification API at all, so this is the only way an app inside the shell can show one.",
      "args": {
        "type": "object",
        "required": [
          "title"
        ],
        "additionalProperties": false,
        "properties": {
          "id": {
            "type": "string",
            "maxLength": 64,
            "description": "Reuse an id to REPLACE that notification rather than stack another."
          },
          "title": {
            "type": "string",
            "minLength": 1,
            "maxLength": 200
          },
          "body": {
            "type": "string",
            "maxLength": 1000
          },
          "ongoing": {
            "type": "boolean",
            "description": "Not dismissable by swipe — for something actually in progress."
          }
        }
      },
      "result": {
        "type": "object",
        "required": [
          "id"
        ],
        "additionalProperties": false,
        "properties": {
          "id": {
            "type": "string"
          }
        }
      },
      "mock": {
        "id": "gate-note"
      }
    },
    {
      "id": "notify.cancel",
      "capability": "notify",
      "kind": "call",
      "minBridge": 1,
      "android": [
        "POST_NOTIFICATIONS"
      ],
      "summary": "Dismiss a notification this app posted.",
      "args": {
        "type": "object",
        "required": [
          "id"
        ],
        "additionalProperties": false,
        "properties": {
          "id": {
            "type": "string",
            "maxLength": 64
          }
        }
      },
      "result": {
        "type": "object",
        "required": [
          "ok"
        ],
        "additionalProperties": false,
        "properties": {
          "ok": {
            "type": "boolean"
          }
        }
      },
      "mock": {
        "ok": true
      }
    },
    {
      "id": "alarm.set",
      "capability": "alarm",
      "kind": "call",
      "minBridge": 1,
      "android": [
        "RECEIVE_BOOT_COMPLETED"
      ],
      "summary": "Fire a notification at a wall-clock time, offline, with the app closed — and again after a reboot. The web cannot do this at all since Notification Triggers was abandoned; it is the reason the APK exists.",
      "args": {
        "type": "object",
        "required": [
          "id",
          "at",
          "title"
        ],
        "additionalProperties": false,
        "properties": {
          "id": {
            "type": "string",
            "minLength": 1,
            "maxLength": 64,
            "description": "Yours to choose; setting the same id again replaces that alarm."
          },
          "at": {
            "type": "integer",
            "description": "Epoch milliseconds. In the past = fire now."
          },
          "title": {
            "type": "string",
            "minLength": 1,
            "maxLength": 200
          },
          "body": {
            "type": "string",
            "maxLength": 1000
          }
        }
      },
      "result": {
        "type": "object",
        "required": [
          "id",
          "at",
          "exact"
        ],
        "additionalProperties": false,
        "properties": {
          "id": {
            "type": "string"
          },
          "at": {
            "type": "integer"
          },
          "exact": {
            "type": "boolean",
            "description": "False when the OS would only take an inexact alarm — Doze may shift it by minutes, and a screen that promises a time must say so."
          }
        }
      },
      "mock": {
        "id": "gate-alarm",
        "at": 1893479400000,
        "exact": true
      }
    },
    {
      "id": "alarm.cancel",
      "capability": "alarm",
      "kind": "call",
      "minBridge": 1,
      "android": [
        "RECEIVE_BOOT_COMPLETED"
      ],
      "summary": "Cancel a scheduled alarm.",
      "args": {
        "type": "object",
        "required": [
          "id"
        ],
        "additionalProperties": false,
        "properties": {
          "id": {
            "type": "string",
            "maxLength": 64
          }
        }
      },
      "result": {
        "type": "object",
        "required": [
          "ok"
        ],
        "additionalProperties": false,
        "properties": {
          "ok": {
            "type": "boolean"
          }
        }
      },
      "mock": {
        "ok": true
      }
    },
    {
      "id": "alarm.list",
      "capability": "alarm",
      "kind": "call",
      "minBridge": 1,
      "android": [
        "RECEIVE_BOOT_COMPLETED"
      ],
      "summary": "Everything currently scheduled — the shell owns this state, so a reinstalled page can rediscover it.",
      "args": {
        "type": "object",
        "additionalProperties": false,
        "properties": {}
      },
      "result": {
        "type": "object",
        "required": [
          "alarms"
        ],
        "additionalProperties": false,
        "properties": {
          "alarms": {
            "type": "array",
            "items": {
              "type": "object",
              "required": [
                "id",
                "at",
                "title"
              ],
              "additionalProperties": false,
              "properties": {
                "id": {
                  "type": "string"
                },
                "at": {
                  "type": "integer"
                },
                "title": {
                  "type": "string"
                },
                "body": {
                  "type": "string"
                }
              }
            }
          }
        }
      },
      "mock": {
        "alarms": [
          {
            "id": "gate-alarm",
            "at": 1893479400000,
            "title": "Gate alarm"
          }
        ]
      }
    },
    {
      "id": "system.update",
      "capability": "system",
      "kind": "call",
      "minBridge": 2,
      "android": [
        "REQUEST_INSTALL_PACKAGES"
      ],